{
  "$schema": "https://json-schema.org/draft/2020-12/schema",
  "$id": "urn:speculo:ops:change-status:v2",
  "title": "Ops Change Status",
  "type": "object",
  "required": [
    "schema_version", "artifact", "scope", "project_id", "change", "change_status", "phase",
    "current_work", "works_run", "created_at", "updated_at", "completed_at", "archived_at",
    "archive_path", "source_revision", "target_fingerprint", "plan_path", "plan_digest",
    "approval_path", "approval_status", "approved_batches", "latest_attempt_id", "outcome", "blockers"
  ],
  "properties": {
    "schema_version": {"const": 2},
    "artifact": {"const": "ops-change-status"},
    "scope": {"enum": ["global", "project"]},
    "project_id": {"type": ["string", "null"], "pattern": "^[a-z0-9]+(?:-[a-z0-9]+)*$"},
    "change": {"type": "string", "pattern": "^[0-9]{4}-[0-9]{2}-[0-9]{2}-[a-z0-9]+(?:-[a-z0-9]+)*$"},
    "change_status": {"enum": ["active", "blocked", "completed", "archived"]},
    "phase": {"enum": ["intake", "assessment", "planning", "awaiting_approval", "approved", "executing", "diagnosing", "stabilizing", "ready_to_archive", "archived"]},
    "current_work": {"anyOf": [{"type": "null"}, {"enum": ["ops/archive-and-learn", "ops/computer-hygiene", "ops/execute-and-stabilize", "ops/intake-and-assess", "ops/plan-and-approve"]}]},
    "works_run": {"type": "array", "items": {"enum": ["ops/archive-and-learn", "ops/computer-hygiene", "ops/execute-and-stabilize", "ops/intake-and-assess", "ops/plan-and-approve"]}, "uniqueItems": true},
    "created_at": {"type": "string", "format": "date-time"},
    "updated_at": {"type": "string", "format": "date-time"},
    "completed_at": {"type": ["string", "null"], "format": "date-time"},
    "archived_at": {"type": ["string", "null"], "format": "date-time"},
    "archive_path": {"type": ["string", "null"]},
    "source_revision": {"type": ["string", "null"], "minLength": 1},
    "target_fingerprint": {"type": ["string", "null"], "pattern": "^[a-f0-9]{64}$"},
    "plan_path": {"anyOf": [{"type": "null"}, {"type": "string", "pattern": "^plan/plan-[0-9]{3}\\.json$"}]},
    "plan_digest": {"type": ["string", "null"], "pattern": "^[a-f0-9]{64}$"},
    "approval_path": {"anyOf": [{"type": "null"}, {"type": "string", "pattern": "^plan/approval-[0-9]{3}\\.json$"}]},
    "approval_status": {"enum": ["not_requested", "pending", "approved", "invalidated"]},
    "approved_batches": {"type": "array", "items": {"type": "string", "pattern": "^B[0-9]{2}$"}, "uniqueItems": true},
    "latest_attempt_id": {"type": ["string", "null"], "pattern": "^ATTEMPT-[0-9]{3}$"},
    "outcome": {"enum": ["pending", "succeeded", "rolled_back", "abandoned"]},
    "blockers": {"type": "array", "items": {"type": "string", "minLength": 1}, "uniqueItems": true}
  },
  "allOf": [
    {"if": {"properties": {"scope": {"const": "global"}}}, "then": {"properties": {"project_id": {"const": null}}}},
    {"if": {"properties": {"scope": {"const": "project"}}}, "then": {"properties": {"project_id": {"type": "string"}}}}
  ],
  "additionalProperties": false
}
