{
  "schema_version": 2,
  "artifact": "ops-change-status",
  "scope": "project",
  "project_id": "{project_id}",
  "change": "{change}",
  "change_status": "active",
  "phase": "intake",
  "current_work": null,
  "works_run": [],
  "created_at": "{created_at}",
  "updated_at": "{updated_at}",
  "completed_at": null,
  "archived_at": null,
  "archive_path": null,
  "source_revision": null,
  "target_fingerprint": null,
  "plan_path": null,
  "plan_digest": null,
  "approval_path": null,
  "approval_status": "not_requested",
  "approved_batches": [],
  "latest_attempt_id": null,
  "outcome": "pending",
  "blockers": []
}
